{
  "category": "random",
  "family": "parallel_chain",
  "id": "random_chain_8",
  "metadata": {
    "generator": "parallel_chain",
    "seed": 260819
  },
  "objective": "makespan",
  "resources": [
    {
      "id": "channel:0",
      "kind": "channel"
    }
  ],
  "scenario": "single_channel",
  "schema_version": "1.0",
  "semantics": {
    "compute_model": "unbounded_parallel",
    "decision_epoch": "task_completion",
    "optional_idle": true,
    "preemptive": true,
    "resource_model": "exclusive"
  },
  "tasks": [
    {
      "dependencies": [],
      "duration": 0,
      "id": "chain0_release",
      "kind": "compute",
      "resources": []
    },
    {
      "dependencies": [
        "chain0_release"
      ],
      "duration": 3,
      "id": "chain0_flow0",
      "kind": "communication",
      "resources": [
        "channel:0"
      ]
    },
    {
      "dependencies": [
        "chain0_flow0"
      ],
      "duration": 0,
      "id": "chain0_compute0",
      "kind": "compute",
      "resources": []
    },
    {
      "dependencies": [],
      "duration": 0,
      "id": "chain1_release",
      "kind": "compute",
      "resources": []
    },
    {
      "dependencies": [
        "chain1_release"
      ],
      "duration": 4,
      "id": "chain1_flow0",
      "kind": "communication",
      "resources": [
        "channel:0"
      ]
    },
    {
      "dependencies": [
        "chain1_flow0"
      ],
      "duration": 3,
      "id": "chain1_compute0",
      "kind": "compute",
      "resources": []
    },
    {
      "dependencies": [
        "chain1_compute0"
      ],
      "duration": 1,
      "id": "chain1_flow1",
      "kind": "communication",
      "resources": [
        "channel:0"
      ]
    },
    {
      "dependencies": [
        "chain1_flow1"
      ],
      "duration": 4,
      "id": "chain1_compute1",
      "kind": "compute",
      "resources": []
    },
    {
      "dependencies": [
        "chain1_compute1"
      ],
      "duration": 2,
      "id": "chain1_flow2",
      "kind": "communication",
      "resources": [
        "channel:0"
      ]
    },
    {
      "dependencies": [
        "chain1_flow2"
      ],
      "duration": 2,
      "id": "chain1_compute2",
      "kind": "compute",
      "resources": []
    },
    {
      "dependencies": [],
      "duration": 0,
      "id": "chain2_release",
      "kind": "compute",
      "resources": []
    },
    {
      "dependencies": [
        "chain2_release"
      ],
      "duration": 4,
      "id": "chain2_flow0",
      "kind": "communication",
      "resources": [
        "channel:0"
      ]
    },
    {
      "dependencies": [
        "chain2_flow0"
      ],
      "duration": 6,
      "id": "chain2_compute0",
      "kind": "compute",
      "resources": []
    },
    {
      "dependencies": [
        "chain2_compute0"
      ],
      "duration": 3,
      "id": "chain2_flow1",
      "kind": "communication",
      "resources": [
        "channel:0"
      ]
    },
    {
      "dependencies": [
        "chain2_flow1"
      ],
      "duration": 0,
      "id": "chain2_compute1",
      "kind": "compute",
      "resources": []
    }
  ],
  "time_unit": "tick"
}